{
  "schema_version": "countershape-source/v1",
  "kind": "SourceSpec",
  "candidate_set_digest": "sha256:1111111111111111111111111111111111111111111111111111111111111111",
  "materialization_policy_digest": "sha256:2222222222222222222222222222222222222222222222222222222222222222",
  "comparison_envelope_digest": "sha256:3333333333333333333333333333333333333333333333333333333333333333",
  "adapter": {
    "domain": "CLI",
    "adapter_version": "cli/v1",
    "runner_digest": "sha256:4444444444444444444444444444444444444444444444444444444444444444"
  },
  "execution_shape": "ONE_CLI_INVOCATION",
  "start_argv": ["node", "fixture/cli.mjs", "--mode", "test"],
  "environment": [{ "name": "LANG", "value": "C" }],
  "fixture_recipe_digest": "sha256:5555555555555555555555555555555555555555555555555555555555555555",
  "capture_policy_digest": "sha256:6666666666666666666666666666666666666666666666666666666666666666",
  "projection_definition_digest": "sha256:7777777777777777777777777777777777777777777777777777777777777777",
  "repeat_schedule": {
    "discovery_repeats": 3,
    "confirmation_repeats": 3,
    "concurrency": "SEQUENTIAL",
    "rotation": "ROTATE_START_BY_REPETITION_V1"
  },
  "required_tools": [{ "name": "node", "version_constraint": "executed-major-only" }]
}
